{
  "attacker_model": "gpt-5",
  "target_model": "gpt-4.1-2025-04-14",
  "defense": null,
  "knowledge_pieces": {
    "tool_names_and_parameters": false,
    "tool_call_schema": false,
    "filters": false,
    "benign_response": false,
    "exception_schema": true,
    "behavioral_rules": false,
    "type_of_agent": false,
    "model_identity": false,
    "guardrails": false,
    "user_persona": false,
    "agent_task": false,
    "injected_tool_output": false,
    "structural_defenses": false,
    "conversation_structure": false,
    "defenses": false
  },
  "triplets": [
    [
      "slack",
      "injection_task_1",
      "user_task_0"
    ],
    [
      "slack",
      "injection_task_1",
      "user_task_1"
    ],
    [
      "slack",
      "injection_task_1",
      "user_task_2"
    ],
    [
      "slack",
      "injection_task_1",
      "user_task_3"
    ],
    [
      "slack",
      "injection_task_1",
      "user_task_4"
    ],
    [
      "slack",
      "injection_task_1",
      "user_task_5"
    ],
    [
      "slack",
      "injection_task_1",
      "user_task_6"
    ],
    [
      "slack",
      "injection_task_1",
      "user_task_7"
    ],
    [
      "slack",
      "injection_task_1",
      "user_task_8"
    ],
    [
      "slack",
      "injection_task_1",
      "user_task_9"
    ],
    [
      "slack",
      "injection_task_1",
      "user_task_10"
    ],
    [
      "slack",
      "injection_task_1",
      "user_task_11"
    ],
    [
      "slack",
      "injection_task_1",
      "user_task_12"
    ],
    [
      "slack",
      "injection_task_1",
      "user_task_13"
    ],
    [
      "slack",
      "injection_task_1",
      "user_task_14"
    ],
    [
      "slack",
      "injection_task_1",
      "user_task_15"
    ],
    [
      "slack",
      "injection_task_1",
      "user_task_16"
    ],
    [
      "slack",
      "injection_task_1",
      "user_task_17"
    ],
    [
      "slack",
      "injection_task_1",
      "user_task_18"
    ],
    [
      "slack",
      "injection_task_1",
      "user_task_19"
    ],
    [
      "slack",
      "injection_task_1",
      "user_task_20"
    ],
    [
      "slack",
      "injection_task_2",
      "user_task_0"
    ],
    [
      "slack",
      "injection_task_2",
      "user_task_1"
    ],
    [
      "slack",
      "injection_task_2",
      "user_task_2"
    ],
    [
      "slack",
      "injection_task_2",
      "user_task_3"
    ],
    [
      "slack",
      "injection_task_2",
      "user_task_4"
    ],
    [
      "slack",
      "injection_task_2",
      "user_task_5"
    ],
    [
      "slack",
      "injection_task_2",
      "user_task_6"
    ],
    [
      "slack",
      "injection_task_2",
      "user_task_7"
    ],
    [
      "slack",
      "injection_task_2",
      "user_task_8"
    ],
    [
      "slack",
      "injection_task_2",
      "user_task_9"
    ],
    [
      "slack",
      "injection_task_2",
      "user_task_10"
    ],
    [
      "slack",
      "injection_task_2",
      "user_task_11"
    ],
    [
      "slack",
      "injection_task_2",
      "user_task_12"
    ],
    [
      "slack",
      "injection_task_2",
      "user_task_13"
    ],
    [
      "slack",
      "injection_task_2",
      "user_task_14"
    ],
    [
      "slack",
      "injection_task_2",
      "user_task_15"
    ],
    [
      "slack",
      "injection_task_2",
      "user_task_16"
    ],
    [
      "slack",
      "injection_task_2",
      "user_task_17"
    ],
    [
      "slack",
      "injection_task_2",
      "user_task_18"
    ],
    [
      "slack",
      "injection_task_2",
      "user_task_19"
    ],
    [
      "slack",
      "injection_task_2",
      "user_task_20"
    ],
    [
      "slack",
      "injection_task_3",
      "user_task_0"
    ],
    [
      "slack",
      "injection_task_3",
      "user_task_1"
    ],
    [
      "slack",
      "injection_task_3",
      "user_task_2"
    ],
    [
      "slack",
      "injection_task_3",
      "user_task_3"
    ],
    [
      "slack",
      "injection_task_3",
      "user_task_4"
    ],
    [
      "slack",
      "injection_task_3",
      "user_task_5"
    ],
    [
      "slack",
      "injection_task_3",
      "user_task_6"
    ],
    [
      "slack",
      "injection_task_3",
      "user_task_7"
    ],
    [
      "slack",
      "injection_task_3",
      "user_task_8"
    ],
    [
      "slack",
      "injection_task_3",
      "user_task_9"
    ],
    [
      "slack",
      "injection_task_3",
      "user_task_10"
    ],
    [
      "slack",
      "injection_task_3",
      "user_task_11"
    ],
    [
      "slack",
      "injection_task_3",
      "user_task_12"
    ],
    [
      "slack",
      "injection_task_3",
      "user_task_13"
    ],
    [
      "slack",
      "injection_task_3",
      "user_task_14"
    ],
    [
      "slack",
      "injection_task_3",
      "user_task_15"
    ],
    [
      "slack",
      "injection_task_3",
      "user_task_16"
    ],
    [
      "slack",
      "injection_task_3",
      "user_task_17"
    ],
    [
      "slack",
      "injection_task_3",
      "user_task_18"
    ],
    [
      "slack",
      "injection_task_3",
      "user_task_19"
    ],
    [
      "slack",
      "injection_task_3",
      "user_task_20"
    ],
    [
      "slack",
      "injection_task_4",
      "user_task_0"
    ],
    [
      "slack",
      "injection_task_4",
      "user_task_1"
    ],
    [
      "slack",
      "injection_task_4",
      "user_task_2"
    ],
    [
      "slack",
      "injection_task_4",
      "user_task_3"
    ],
    [
      "slack",
      "injection_task_4",
      "user_task_4"
    ],
    [
      "slack",
      "injection_task_4",
      "user_task_5"
    ],
    [
      "slack",
      "injection_task_4",
      "user_task_6"
    ],
    [
      "slack",
      "injection_task_4",
      "user_task_7"
    ],
    [
      "slack",
      "injection_task_4",
      "user_task_8"
    ],
    [
      "slack",
      "injection_task_4",
      "user_task_9"
    ],
    [
      "slack",
      "injection_task_4",
      "user_task_10"
    ],
    [
      "slack",
      "injection_task_4",
      "user_task_11"
    ],
    [
      "slack",
      "injection_task_4",
      "user_task_12"
    ],
    [
      "slack",
      "injection_task_4",
      "user_task_13"
    ],
    [
      "slack",
      "injection_task_4",
      "user_task_14"
    ],
    [
      "slack",
      "injection_task_4",
      "user_task_15"
    ],
    [
      "slack",
      "injection_task_4",
      "user_task_16"
    ],
    [
      "slack",
      "injection_task_4",
      "user_task_17"
    ],
    [
      "slack",
      "injection_task_4",
      "user_task_18"
    ],
    [
      "slack",
      "injection_task_4",
      "user_task_19"
    ],
    [
      "slack",
      "injection_task_4",
      "user_task_20"
    ],
    [
      "slack",
      "injection_task_5",
      "user_task_0"
    ],
    [
      "slack",
      "injection_task_5",
      "user_task_1"
    ],
    [
      "slack",
      "injection_task_5",
      "user_task_2"
    ],
    [
      "slack",
      "injection_task_5",
      "user_task_3"
    ],
    [
      "slack",
      "injection_task_5",
      "user_task_4"
    ],
    [
      "slack",
      "injection_task_5",
      "user_task_5"
    ],
    [
      "slack",
      "injection_task_5",
      "user_task_6"
    ],
    [
      "slack",
      "injection_task_5",
      "user_task_7"
    ],
    [
      "slack",
      "injection_task_5",
      "user_task_8"
    ],
    [
      "slack",
      "injection_task_5",
      "user_task_9"
    ],
    [
      "slack",
      "injection_task_5",
      "user_task_10"
    ],
    [
      "slack",
      "injection_task_5",
      "user_task_11"
    ],
    [
      "slack",
      "injection_task_5",
      "user_task_12"
    ],
    [
      "slack",
      "injection_task_5",
      "user_task_13"
    ],
    [
      "slack",
      "injection_task_5",
      "user_task_14"
    ],
    [
      "slack",
      "injection_task_5",
      "user_task_15"
    ],
    [
      "slack",
      "injection_task_5",
      "user_task_16"
    ],
    [
      "slack",
      "injection_task_5",
      "user_task_17"
    ],
    [
      "slack",
      "injection_task_5",
      "user_task_18"
    ],
    [
      "slack",
      "injection_task_5",
      "user_task_19"
    ],
    [
      "slack",
      "injection_task_5",
      "user_task_20"
    ]
  ]
}