{
  "attacker_model": "gpt-5.1",
  "target_model": "gpt-4.1-2025-04-14",
  "defense": null,
  "knowledge_pieces": {
    "tool_names_and_parameters": false,
    "tool_call_schema": false,
    "filters": false,
    "benign_response": false,
    "exception_schema": false,
    "behavioral_rules": false,
    "type_of_agent": false,
    "model_identity": false,
    "guardrails": false,
    "user_persona": false,
    "agent_task": true,
    "injected_tool_output": false,
    "structural_defenses": false,
    "conversation_structure": false
  },
  "triplets": [
    ["workspace", "injection_task_0", "user_task_0"],
    ["workspace", "injection_task_0", "user_task_1"],
    ["workspace", "injection_task_0", "user_task_2"],
    ["workspace", "injection_task_0", "user_task_3"],
    ["workspace", "injection_task_0", "user_task_4"],
    ["workspace", "injection_task_0", "user_task_5"],
    ["workspace", "injection_task_0", "user_task_6"],
    ["workspace", "injection_task_0", "user_task_7"],
    ["workspace", "injection_task_0", "user_task_8"],
    ["workspace", "injection_task_0", "user_task_9"],
    ["workspace", "injection_task_0", "user_task_10"],
    ["workspace", "injection_task_0", "user_task_11"],
    ["workspace", "injection_task_0", "user_task_12"],
    ["workspace", "injection_task_0", "user_task_13"],
    ["workspace", "injection_task_0", "user_task_14"],
    ["workspace", "injection_task_0", "user_task_15"],
    ["workspace", "injection_task_0", "user_task_16"],
    ["workspace", "injection_task_0", "user_task_17"],
    ["workspace", "injection_task_0", "user_task_18"],
    ["workspace", "injection_task_0", "user_task_19"],
    ["workspace", "injection_task_0", "user_task_20"],
    ["workspace", "injection_task_0", "user_task_21"],
    ["workspace", "injection_task_0", "user_task_22"],
    ["workspace", "injection_task_0", "user_task_23"],
    ["workspace", "injection_task_0", "user_task_24"],
    ["workspace", "injection_task_0", "user_task_25"],
    ["workspace", "injection_task_0", "user_task_26"],
    ["workspace", "injection_task_0", "user_task_27"],
    ["workspace", "injection_task_0", "user_task_28"],
    ["workspace", "injection_task_0", "user_task_29"],
    ["workspace", "injection_task_0", "user_task_30"],
    ["workspace", "injection_task_0", "user_task_31"],
    ["workspace", "injection_task_0", "user_task_32"],
    ["workspace", "injection_task_0", "user_task_33"],
    ["workspace", "injection_task_0", "user_task_34"],
    ["workspace", "injection_task_0", "user_task_35"],
    ["workspace", "injection_task_0", "user_task_36"],
    ["workspace", "injection_task_0", "user_task_37"],
    ["workspace", "injection_task_0", "user_task_38"],
    ["workspace", "injection_task_0", "user_task_39"],
    ["travel", "injection_task_0", "user_task_0"],
    ["travel", "injection_task_0", "user_task_1"],
    ["travel", "injection_task_0", "user_task_2"],
    ["travel", "injection_task_0", "user_task_3"],
    ["travel", "injection_task_0", "user_task_4"],
    ["travel", "injection_task_0", "user_task_5"],
    ["travel", "injection_task_0", "user_task_6"],
    ["travel", "injection_task_0", "user_task_7"],
    ["travel", "injection_task_0", "user_task_8"],
    ["travel", "injection_task_0", "user_task_9"],
    ["travel", "injection_task_0", "user_task_10"],
    ["travel", "injection_task_0", "user_task_11"],
    ["travel", "injection_task_0", "user_task_12"],
    ["travel", "injection_task_0", "user_task_13"],
    ["travel", "injection_task_0", "user_task_14"],
    ["travel", "injection_task_0", "user_task_15"],
    ["travel", "injection_task_0", "user_task_16"],
    ["travel", "injection_task_0", "user_task_17"],
    ["travel", "injection_task_0", "user_task_18"],
    ["travel", "injection_task_0", "user_task_19"],
        ["banking", "injection_task_0", "user_task_0"],
    ["banking", "injection_task_0", "user_task_1"],
    ["banking", "injection_task_0", "user_task_2"],
    ["banking", "injection_task_0", "user_task_3"],
    ["banking", "injection_task_0", "user_task_4"],
    ["banking", "injection_task_0", "user_task_5"],
    ["banking", "injection_task_0", "user_task_6"],
    ["banking", "injection_task_0", "user_task_7"],
    ["banking", "injection_task_0", "user_task_8"],
    ["banking", "injection_task_0", "user_task_9"],
    ["banking", "injection_task_0", "user_task_10"],
    ["banking", "injection_task_0", "user_task_11"],
    ["banking", "injection_task_0", "user_task_12"],
    ["banking", "injection_task_0", "user_task_13"],
    ["banking", "injection_task_0", "user_task_14"],
    ["banking", "injection_task_0", "user_task_15"]
  ]
}
